{
  "$schema": "./schema.json",
  "schema_version": 1,
  "id": "crossover-24.0.7",
  "upstream": {
    "name": "CodeWeavers CrossOver sources",
    "homepage": "https://media.codeweavers.com/pub/crossover/source/"
  },
  "source": {
    "version": "24.0.7",
    "url": "https://media.codeweavers.com/pub/crossover/source/crossover-sources-24.0.7.tar.gz",
    "sha256": "56749e926df9f0437dbcea259cf0bff6657a43871af50182887fe15a84fc2e4e",
    "sha256_provenance": "Independently calculated from the official HTTPS archive on 2026-08-13; no publisher checksum sidecar was available.",
    "source_date_epoch": 1738068240
  },
  "build": {
    "source_subdirectory": "sources/wine",
    "targets": ["linux-x86_64", "macos-x86_64"],
    "patches": [
      {
        "path": "patches/24.0.7/0001-ntdll-separate-syscall-return-entry.patch",
        "sha256": "4e8b090705932af77e083fbccfdb06ab554dea970daf4714efde5b5a27d936b8",
        "provenance": "Minimal backport derived by comparing the SHA-256-pinned official CrossOver 24.0.7 and 25.1.1 source archives.",
        "targets": ["macos-x86_64"]
      },
      {
        "path": "patches/24.0.7/0002-winemac-load-obsolete-window-image-api.patch",
        "sha256": "6383423fed51bdfb6ef9e374c960af9acb4f9a0ddc6096ea55cd7731e2fa91c1",
        "provenance": "Focused macOS 15 SDK compatibility backport derived from the SHA-256-pinned official CrossOver 25.1.1 source archive.",
        "targets": ["macos-x86_64"]
      },
      {
        "path": "patches/24.0.7/0003-winhlp32-remove-unused-bool-field.patch",
        "sha256": "4b7eb5bef5ebcc4aa426c9fa508719fa35fe4b14f47c7d2d9c1df7b75a71c629",
        "provenance": "One-line modern MinGW compatibility backport derived from the SHA-256-pinned official CrossOver 25.1.1 source archive.",
        "targets": ["macos-x86_64"]
      },
      {
        "path": "patches/24.0.7/0004-configure-avoid-ms-abi-with-pe-compiler.patch",
        "sha256": "fdfaa170370b1d87fcbe944f8c2f95d0b44dbb788fab9839ee1da86792cbfcdb",
        "provenance": "Minimal PE-compiler ABI flag fix derived from the corresponding configure logic in the SHA-256-pinned official CrossOver 25.1.1 source archive.",
        "targets": ["macos-x86_64"]
      },
      {
        "path": "patches/24.0.7/0005-winebuild-place-delay-iat-in-didat.patch",
        "sha256": "cbd6ef100ed5ea1f4b1be205a28d4139f48424fa9d04228a5474c71a5f466e22",
        "provenance": "Compatibility backport for modern Binutils PE delay-import section semantics; delay IAT pointers must remain writable.",
        "targets": ["macos-x86_64"]
      },
      {
        "path": "patches/24.0.7/0006-winebus-limit-iohid-to-game-controllers.patch",
        "sha256": "529bd9c876a5ee083b8f126c7fd567bb8a055713215465c6742a784422cd0eab",
        "provenance": "Adapted backport of upstream Wine commit c5f9d9188a6dea5b9e9e4a2f8fbf362f11b5e72b, restricting an explicitly enabled IOHID backend to game controllers as defense in depth.",
        "targets": ["macos-x86_64"]
      },
      {
        "path": "patches/24.0.7/0007-winebus-disable-iohid-by-default.patch",
        "sha256": "4d7844926d294d1d31c128ca972fa85ab1a8014bb8ce03fd188fb7d8ec5c0f94",
        "provenance": "Wineforge privacy default verified on macOS: direct IOHID controller access is opt-in so fresh Wine prefixes do not request Input Monitoring permission.",
        "targets": ["macos-x86_64"]
      },
      {
        "path": "patches/24.0.7/0008-winemac-strict-window-isolation.patch",
        "sha256": "b440679bf99efd9817b08da7c4a92f727b1452a63e40d9186fb28eb6cead9013",
        "provenance": "Wineforge process-local policy for hiding and restoring Wine-owned floating windows when the application resigns or regains activity.",
        "targets": ["macos-x86_64"]
      }
    ]
  },
  "capabilities": {
    "protocol": 1,
    "declarations": [
      {
        "id": "input.mapping",
        "version": 1,
        "state": "planned",
        "targets": ["macos-x86_64"],
        "features": {
          "keyboard": true,
          "keyboard_to_scroll": true,
          "precise_scroll": true,
          "horizontal_scroll": true,
          "momentum": true,
          "drag_scroll": true
        }
      },
      {
        "id": "macos.window-isolation",
        "version": 1,
        "state": "provided",
        "evidence_patches": ["patches/24.0.7/0008-winemac-strict-window-isolation.patch"],
        "targets": ["macos-x86_64"],
        "scope": "process",
        "privacy": {
          "requires_external_window_observation": false,
          "requires_accessibility": false,
          "requires_screen_recording": false,
          "requires_input_monitoring": false
        }
      },
      {
        "id": "host.bridge",
        "version": 1,
        "state": "planned",
        "targets": ["linux-x86_64", "macos-x86_64"],
        "transports": ["unix-socket", "named-pipe"]
      }
    ]
  },
  "redistribution": {
    "status": "review_required",
    "reason": "Component-level licence and corresponding-source obligations must be reviewed before public binary release."
  }
}
